Features,Label
"Also, there are formal medicolegal definitions of what comprises a patient-physician relationship, and telling your spouse to take an OTC NSAID, regardless of your licensure status, does not qualify. This is some juvenile tehehe I could get a speeding ticket because I flew on an airplane going 250mph going over a stretch of I95 where the limit is 70 nonsense.",yes
"I was in a similar situation when I first started in 2022, albeit in family med. However, even with a doc not necessarily on site full time, there were still a handful of them a phone call away. The other thing to remember is, you're working in a low acuity outpatient setting. If anything ever seems off, no one will ever blame you if you call EMS. It rarely happens, but I have had to do it a couple times. So between your SP and EMS being able to respond in minutes, this should at least give you the peace of mind to go about your day and adjust to the new gig. There will always be a learning curve. Think of it as an opportunity to grow as a clinician. It's turned out to be great for me and my own medical decision making, personally. Also, it would be helpful to know some details about why the other PA quit. People leave jobs ALL the time in healthcare. Chasing sign on bonuses and whatnot. But high turnover at a particular office can also be a huge red flag. Do you know why they left? How long they had been with the practice? tldr don't let this turn you off before you even start. You always have the option of walking away, but it seems to me that it is far too early to make any conclusive decisions about this job. Barring any additional info anyway. Best of luck!",no
I really feel for that OR staff. How traumatizing to have watched all of that happen. This case is insane. He also accidently removed part of a pancreas from another patient instead of the right adrenal gland. Wild.,yes
"Welcome to the ED and thanks for asking this. I love learning. I was always vocal about that and being so meant a lot of docs would grab me to help with interesting things. Be open to letting those that are curious have opportunities to grow. It's a great opportunity to mentor if you're into that at all. Do your best to lead with kindness. Champion mental health for all of us, including you. Reassure the rookies with confidence, humor, and support. Communicate. Really important to stay in the loop when we're interacting much more with individual patients and families. Know when to ask for help and demand the same from your nurses. Good luck!",no
"I start working on the floor next week and im kinda nervous to start. I keep hearing about how my floor is kinda like the wild west of the hospital and if i can make it there, i can make it anywhere.. it's making me nervous about my performance as it's possible i can be let go if by end of orientation im not up to their standards and handling the full patient load. I was under the impression (during my interview) that id get 12 weeks orientation, but i just found out it's 6 weeks. It makes me nervy cuz at another hospital it's 8 weeks for the same ratio, but here is 2 weeks less??   I had clinicals in arizona where the ratio was 6pts to 1 nurse, so i thought i could handle 4 pts by end of my orientation. Now i just feel slightly scared after hearing those comments and everything. I kno that we all start somewhere, it just nerve wracking. I also do not want to be let go, so im going to try my best because i tried so hard to land this job. I desperately need this job to work out for me, i cannot go back to being unemployed. Anyways just dumping my thoughts here",yes
"I don't work in the OR, but reading the order of suspension makes it sound like they couldn't actually see what he was doing (especially considering the surgeon himself was apparently operating blind too),until he handed them a whole ass liver at the end. At that point the patient had been dead for 15 minutes already. This report doesn't say so, but *surely* multiple OR staff spoke up and reported this after the fact,right?!",yes
"Legit question, why? Because it's disingenuous and irresponsible to pretend that lexapro and dilaudid have identical risk profiles, whether for typical use or severity of withdrawal symptoms. SSRI's cause withdrawal too but you are ok with that? yes? Why wouldn't I be? SSRI withdrawal is far easier to prevent/taper than opioid withdrawal. And the morbidity from SSRI withdrawal is far less severe than with opioid withdrawal. now it's pounded into everyone's head that it's going to make everyone an addict. Agreed. MDs are too scared of opioids. But again not everyone that is on an opioid medication is misusing it Agree, and I never said they were. even if there is chemical dependence that is just the nature of some medications. And it is the nature of some medications that the *degree* of chemical dependence is far higher than it is with other meds. I think you've misread me as an opioid gatekeeper. When really my point was, you can't throw all dependencies into the same category and dismiss them or accept them on the same terms. Some patients are dependent on opioids in a negative way, others are dependent in a positive way (or at least in a neutral way). Replace ""opioids"" with ""SSRIs"" and that statement is still true. *However,* all the data we have (and our best understanding of neurochemical pathways), tells us that opioid dependence is much more *relatively* dangerous than SSRI dependence. Like i said, the more philosophical question of whether America is focused on the wrong dependencies, is entirely valid and worth discussing. But it's a different question from whether certain dependencies are more medically dangerous than others.",no
Some insurance company has my hospitalist group listed as infectious disease. We get calls everyday looking to set up care and have to tell them we're an inpatient medical group. Our coordinator has spent about 6 years attempting to fix this to no avail.,yes
"Part of the problem is that patients learn, and some of them have been trained that only a pain score of 7+ is taken seriously. Some hospital systems have rather rigid prescribing guidelines based on pain scores, where a score below 6 is not treated, and a 7 or 8 will get APAP. Then those patients go to a different hospital system and never rate their pain below a 7 because they want access to NSAIDs if they feel they need them.",yes
"wheels to imaging, sits in the control room while the study is performed, reads the study, does some procedure I have actually done that, when a patient is very unstable, and it's a weekend or holiday, and there's not much staff. I have never ever drawn labs on the floor (only in the trauma bay with a femoral stick) or looked at slides (other than a path rotation).",no
"NP never made it to med school, she did not go through the grueling and long weeding out process of undergrad, med school and residency for quality control and public safety. She did not pass the difficult tests. She did not do the 10 12 hr shifts for years straight in residency. She did not see enough cases under proper supervision. She did not have to do the hundreds of hours to maintain her medical license and board certifications every few years. She has not been tested and pass the mental endurance a physician has to pass. She's inferior in every way in regard to quality medical care a physician can provide.",yes
"Hypoglycemia is an immediate neurologic injury risk so not treating it to wait 30min to 1hr for thiamine is indeed an obviously bad idea. But having banana bags in the pyxis and starting it right away can nearly eliminate that malpractice risk too. Problem is shortages are constant on thiamine IV solutions... Bigger issue is not thinking of thiamine in a non-alcoholic patient that is malnourished (cancer, eating d/o, major weight loss/GI surgery).",no
"I understand that and respect that, but if I know I'm getting report from long-winded nurses, I will try to avoid them first, too. I also have years of experience where I will tell long-winded that I want the cut and dry basics, which helps speed things along. But that comes with experience to have the cajones to tell those people to abbreviate report. But you are right, where people take too long. But if you're going to pounce, tell me why. *Rncookiemaker,I got dibs for report to you first because long-winded RN has your other five patients.*",no
"This is a feature, not a bug. When insurers do not want more patients with a particular type of ailment they simply refuse to credential more providers in the hope that those patients will change plans.",no
"Yeah, it was awful. I'm pretty sure my patient thought I was going crazy. It is like my vision becomes tunneled. I can't think or say proper sentences. I'm in the process of finding a new prescriber right now. I'm just on the 20 mg. I'd love to bump it up.",no
"No, the bill rate is wildly inflated because if you overbill insurance pays you the max amount and you can bill the patient the rest. If you underbill, insurance pays you that amount and you lose x-extra amount. So to get the ""max"" money you always have to overbill. BEcause hospitals don't have these neat nice insurance agreements like you want.",no
"I think people wrongly believe that their ""pain"" needs to be exaggerated to get some attention or prioritization. Not making a statement about the system here - just speculating. I do not personally do this. I've had some pretty bad pain as of late but wouldn't classify it north of a 5 even though it is impacting sleep and scaring me as to what it is. When doctors or nurses clarify that 10/10 is the worst pain I've ever felt, the pain I'm there for is NEVER that bad (flipping in a golf cart several times down a mountain, breaking ribs in a rugby match, etc). But, I think a lot of people are responding to how impacted they are in the lives by whatever issue is at play. I suspect folks posing the question need to have some examples, like a 5 is when you miss the nail and hit your thumb wiht a hammer, or 3 is a wasp sting. When someone tells you their stomach pain is a 9 or 10, you say ok so this is you gearing up to give birth type of pain?",no
Or assess a patient ,no
"Admitting a transfer patient with an irate borderline belligerent mother, granted it was 2AM but the icu was out of beds and this patient was the most stable to transfer out so they could take a trauma. The mom complaining this is bullshit the doctor himself won't even come see me I'm reporting everybody there's no reason I don't care that somebody else needed his room they should have figured it out. Me knowing the doctor is 4 rooms over trying to keep a patient alive long enough to save the organs to be donated and the family to say goodbye, knowing that's why the doctor refused to tell her himself and why they needed the bed.",yes
I had a dayshift bully me into helping transfer a stable patient down to another unit. They have more staff than we had. They only wanted someone since the bed is difficult to steer. I was almost an hour late leaving the hospital and had an hour drive home. Like look if it was an emergency or the patient was unstable I'd get it. But that wasn't the case. I was so mad I cried half the way home.,yes
"I actually begged to be transferred to the pediatric side of the hospital because I'd had several hospital stays on that side and was never treated that way. Unfortunately my injuries and being so close to 18 made me an adult case, so I was just made to lay in my own bloody mess until that nurse came along. She actually made sure my linens got changed the same day by advocating for physical therapy to get me out of bed and it made me feel so much better in such a bad scenario. She was my first glimmer of hope in a dark time.",no
It never goes away. Nurses claim to save patients from doctors. But most nurses don't even know basic physiology.,yes
"This sounds very inappropriate for a new grad. Also stop being afraid to ask for help. That doc is there, ask every time. Sit down today with your superior and discuss this. You need more close training and mentorship. If this post is even real (sorry OP, when there's no post or comment history I question if this is made up by someone to repost on anti PA forums) - you need to immediately cry foul to protect your patients and your license, leaving if need be.",no
"assuming you only work inpatient? outpatient pain management has higher risk of consequences, i think.",no
"Minimum wage doesn't lend itself well to doctor shopping. The reason your disheveled patient may be agitated can easily be attributed to: literal pain, loss of time of work, having to arrange for travel. They are more likely to ""wait it out"". The office visit = gas, the medication = groceries. So to be to withstand so much before you seek care and the sacrifice you must make to present for medical care to be denied it arbitrarily based on the mood/bias of the doctor you see that day... I don't know how to not be in pain in America right now.",no
I don't get why it's confusing? One has less education and one has more? Like an NP Vs a physician.,no
"We had a guy a few years ago that was a no code but not officially hospice/CMO. He deteriorated very quickly and we were trying to call his sister (for decision making on short notice as she adamantly refused opioid analgesia and he was suffering at this point and badly needed it) and for hours she didn't answer. The guy died and when she finally called back an hour later and then came, she went ABSOLUTELY BAT SHIT over the fact that his face had been clean shaven. For reference he had a nasty ratty beard with mats and food and one of the techs during the day cut it all off for hygienic reasons. The patient was very rude and quite unpleasant when he was alive. His sister was more upset over his damn face being shaved then him dying ffs",yes
"I don't have advice but solidarity. I don't have near the experience you do, but know that your time is invaluable. I agree, nurses coming out of school don't understand the time it takes to fully understand the patient population. They expect sick patients right out of the gate. There is no patience anymore. I left the NICU because I moved states, I've tried serval different specialties for one reason or another and I've always found myself wanting to go back. I've had the sickest of the sick and I don't need that adrenaline rush anymore. I'm simply happy to have the feeder growers because there is no unit in any hospital like the NICU",no
This is why I really believe all nurses should start at the bottom and work their way up. I was a CNA first and I really think this opened my eyes to how skin ulcers and hygiene are very important. We can do better. Our patients deserve better. I can't imagine being in a bed helpless. I can't.,no
"Consider your sample bias. I'm sure there are folks in your institution like this, but likely far fewer. I practice in a rural area where the provider to patient ratio is 1:2,300 and so even the clinicians who do care simply don't have the time or ability to handle the zebras well or to afford the bedside manner that better ratios provide. I went to school in DC (GWU) which was a starkly contrasted experience that sounds more like what you're used to.",yes
"Agreed. My office is nicely nestled inside of our hospital and gives us access to almost immediate labs and imaging. We have one urgent care slot an hour for same day appointments so I feel like I've cross trained in both urgent care and family med. I'm sure once my patient panel grows to unreasonable limits that the urgent care visits will slow down, but it's nice to throw in a URI or two after seeing my cirrhosis and ESRD patients.",no
"I was told if the family stands at the bedside praying enough and yelling at the staff this is the likely outcome. Coma-- procedure or 1 dose of ten RIGHT med-- sleep -- happy, healthy patient. But it all depends on the amount of yelling the family does on their advocacy work. ",yes
"I worked on a med/surg floor for about 5 yrs. Saw a lot of admissions from nursing homes. It was never necessary to know which one they came from, from a medical point of view, but there were definitely a few facilities that became infamous for the condition the patient would be in. These patients were always the sickest, the dirtiest, untreated and undocumented bed sores and, possibly bed bugs or roaches. One facility even got the nickname ""Gateway to Heaven"" from staff because of the blatant lack of care their residents received.",yes
"Eh, toileting patients can be really time-consuming, and I don't expect docs to do that. It's also why I'll delegate it if able - I can start a couple of IVs and medicate someone in the time it takes grandma to pee.",no
"I stopped asking numbers as well. It's so hard to base pain on a numeric scale. I ask does it hurt really bad, if meds are ordered, which do you prefer, the lower or higher dose. A lot of my patients I've found don't want to over medicate so they will take that lower dose. It's probably unconventional but whatever.",no
