Features,Label
"From a practical medical standpoint, I agree it's probably not all that important. Particularly if the patient is hypoglycemic. But from a CYA standpoint, it's considered standard of care and could create legal issues.",yes
"Someone still trying to point the finger my way, I'm sure. ""Blood loss would have been less extreme if anesthesia kept BP lower."" I wish I was being facetious. A spine surgeon documented this and told something to that effect to the family after he put a screw through the common iliac and killed a patient.",yes
"Reminiscent of Covid, when nurses had no incentive to work with Covid patients or during the peak of Covid. Hospital leadership rarely give a shit to their foot soldiers. It's always about the money.",yes
"I've worked in healthcare for 15 years (CNA/tech partner/mental health tech) and MOST bodily fluids don't bother me, except for lung butter. Had a patient with a trach shoot lung butter on my forearm while coughing and I almost horfed right there. Mad props to folks that work in respiratory because I absolutely can not.",yes
"Multiple things can be true at the same time. You can have legitimately never seen anything similar happen in your career or personal life. Likewise, out of the billions of patients in the world, there can exist an amount who have had their symptoms completely disregarded and their pain not treated. Respectfully, if you can not see beyond your own personal experiences, you should probably check your internal biases.",no
"I'm an NP and live in Canada where I'm tied to a physician for consultative purposes ONLY if I need help with a diagnosis or treatment plan, which the requirement will be changing very soon because we have enough NPs to take over that role for new graduates. Also, we have the ability to curbside consult specialists just as a GP would. I practice completely independently to the scope of a GP. The GP has no say over my practice and is not responsible for my practice in any manner. But I would never expect to be paid the same amount. Like 75%? I'd be happy with. I'm with the physicians on this one. I didn't have to sacrifice my 20s and early 30s for my career. I started off with a good paying job as an RN after graduation. And now as an NP my patient benchmarks and roster are like half what a physician has to see. But that being said, I think the education argument becomes less once an NP has been practising for several years - considering we don't just graduate and stop learning (if you're a good NP). And the education in Canada is pretty rigorous and standardized and there is more regulation coming down the pipeline that will improve it more.  That being said, I'm relating this to a family physician, not a different specialty. I'd never agree with NP basic education being similar to another specialist without having additional didactic and residency experience equivalent to that specialist's post grad requirements. Plus, aren't these NPs required to have supervision by an MD? They are not independent then. You can't expect to be paid independent wages when someone else's license is at stake.  I also think that GPs are grossly underpaid compared to other specialties. And NPs are also grossly underpaid. But equal? No. ",yes
"The pay is not just for the work, but for the knowledge and experience, which NPs certainly can't remotely compare to physicians.",no
"I had a patient who got transferred to us from another hospital because they had no idea why they were in cardiogenic shock. Young, healthy, no family or personal medical history. Barrage of viral and bacterial workups, numerous vials of blood to test the most rare diseases that could lead to it. Must have drawn hundreds of vials, and even with the patient having an A-line, it was annoying sitting down to chart, and then ""hey we ordered a few more labs that we might need."" I hit em with an annoyed, ""that's the last of it, right?"" They say yes, then they send an intern to tell me they needed other ones a few mins later. It's not hard to discuss among each other for a bit, then decide to order them all together.",yes
"This was my thought. It absolutely happens in rural medicine. I literally field these patients almost every day I work. Sometimes it's legit no one worked them up, sometimes the patients are legit dramatic and have their story wrong. Trying to decipher which is which can be, interesting at times. Not sure if city, metro area type docs are similar or not",no
Unfortunately I could not stay any longer. I understand your point. I did however stay over two hours to help code this patient and handle the coroner call and organ donation paperwork. There was also a call team that could have stayed but I also don't think they should have had to do that.,yes
We had a patient that got Wernike encephalopaty after a cancer gastrectomy...so it checks all the boxes of restrictive diet + thiamine deplection in a malnourished patient ,yes
"Ableism absolutely is a problem. And it is a shame, because there are a lot of people who would make excellent, intelligent, and empathic healthcare providers if training programs were accessible and just more humane. I think privilege is an issue as well, and that's something that isn't necessarily discussed and it's something we can be completely unaware of despite good intentions. We can say ""I'm not biased!"" while being ignorant of privilege. In my own case, when I was pregnant in grad school, the linguistics and anthropology departments I was in worked closely with some of the med school professors (20+ years ago they were trying to design ""virtual patients"" for the med school, and there were MD/PhD programs in med anth and public health, as well). So I was introduced to my maternal-fetal medicine specialist by first name and treated collegially in a way that I had no idea wasn't normal--I had nothing to compare it to. Over a decade later, when I returned to grad school to focus more on bio anth/evolutionary medicine and related my story, which included teasing banter with the geneticist and sh!t like that, during a discussion of birth trauma, the professor basically jumped down my throat, and I was humbled--which was fine with me! I love learning new things, and I have no problem being wrong. But she basically used my experience as a jumping off point to talk about socioeconomic disparities to obstetric care, and lit my fuse as a social justice warrior. Some things we just don't see until someone points them out to us--and all the bias training in the world won't help us see our own privilege until we are open to seeing it. And I think that comes back to what you're saying about ableism. People who can pull 48 hour shifts-or can they? really?-may not realize that that is privilege, not the norm, not something to measure others by.",no
"I've worked in colorectal surgery for 10 years and have supported 5 surgeons to varying degrees over the years. 2 of them have been absolute delights and I could bet money on how they would manage their patients. 2 of them were a-holes, but again you'd be done with clinic by 3 pm and practiced reliably the same. 1 surgeon treated every patient uniquely, you could never anticipate what she would want, and she had a deep martyr complex. Depending on the other interactions she had that day, you may get cookies or you may get the silent treatment or maybe you get yelled at in front of a patient. I finally left the group for a non-surgical specialty and I have no clue what to expect bc my whole career I've been surrounded by surgeons.",yes
"No one knows everything about everything. If I have family in the room, I always bring my computer with me so I have access to the patient chart as well as up to date. If I look something up and I can't find it, I'll tell them let me get some more information about that and I'll let you know. Another of my favorite phrases is I don't want to give you incorrect info so let me double check and I'll get back to you.   The most important things are to be honest and to remember to come back and tell them what you've found out.",no
"I had a patient scream at the top of their lungs when I die, bury me upside down so the whole world can kiss my ass!",yes
Plenty of NPs equally smart as MDs yep. I don't blame you for looking for work life balance as an NP and I'm not questioning that you're probably a good clinician. But in no way in hell should a NP be paid the same as a Physician.,no
Give clear discharge instructions. Include what the patient needs to do and what they should come back to the ER for. I like knowing what your plan is for a the patient. If this doesn't get clearly communicated ideally in the discharge paperwork the nurse either has to clarify with you or figure out the DC instructions on their own which isn't ideal.,no
"No time for a phone call when you're 50 meters away lol. But that does remind me of my EMT days in Oakland back in the mid 2000s where we would call the ER from our Nokias and give them a heads up that we were coming in with a disaster-splash and they would be like, ""mm-hmm, mm-hmm, okay, click!"" And then we'd show up and watch the patient code on the gurney while the intake nurse asked me to spell their last name for the third time.",yes
"Someone I know is an ""herbalist"". She diagnosed ""acid wave"" in a patient who complained of vague abdominal cramping and early satiety. By the time this patient presented to the ED she had painless jaundice and extreme ascites. Hepatocellular carcinoma. 10L paracentesis removed. How is this legal?",yes
"Ask the more senior PAs what their salary trajectory has been like. If they have gotten good raises over time, then doing one year of lower income with good training would be an investment if time. If training is great, then consider it similar to a post grad training program with you having more responsibility to being a self starter as well as for patient care.",no
"This sounds like a big mess long before the liver came out. Can someone tell me what the real idea was for the surgery? Why didn't anyone anticipate the mega colon? The colon would be pretty obvious on pre-op X-rays. The abdomen would be distended. The picture I get, you slice open the abdomen and colon comes spilling out like party balloons. How do you see anything? Then you dissect out the wrong vessel and transect the IVC. The field immediately fills up with blood and the patient codes. You can't see anything, but now you are up to your elbows in distended colon swimming in a pit of blood. They are doing CPR. Everything is sloshing back and forth. You don't have enough suction to get ahead. Removing the liver is a post mortem event. You already killed the patient at the IVC laceration. Take out anything you want.",no
"He swore he'd never been told that. Had never taken water pills of any kind before. He had no diagnosis of CHF with our office previously -I'm attached to a larger pcp office so I had his PCPs chart also. I was kinda dumbfounded but from everything he told me, (always take that with a grain of salt) he stated my cardiologist told me my heart was fine and wasn't causing my SOB so I'm here to figure out what is causing it if it's not my heart, he thought he had pneumonia or something lung related. I know patients aren't always great historians but I felt like this was more than just him being forgetful considering how much history he gave me. I would love to know how the convo with his cardio went. I had him take his labs and xray with him. We're out in the boonies, so care is questionable sometimes, even with specialists who should know much more than I do.",yes
"Depends on the job. There are Psych positions with 0 physical demands. On the other end of the spectrum there is Ortho, but likely still not as high as paramedic. In the OR, you'll have to stand for several hours a day, help transfer patients, pull hard on retractors, etc. I'm in Ortho and I could probably do it until my goal retirement age of 62 considering there are surgeon operating into their 70s. However, I did have to start working out because of the demands of doing reductions and such. However, given you already have a 6 figure desk job with good benefits, I couldn't recommend you go back to PA school. Sure you can make a bit more money, but you'll be spending at least 100K for school, and losing 300-500K in your current wages and benefits while in PA school. I don't think you could catch up financially, and even if you could I don't think it's worth the effort.",no
Did you get a training period? If not I'd ask to be properly trained because you not knowing what you're doing (due to lack of support) is going to affect your patients. Either they train you or find a new job.,no
"Anyone who says they never made a mistake, they r either lying or dumb! An example of critical thinking is when u go back and review an event, see what went wrong and what can be improved upon. Most of the time you'll find out it's a combination of human error System error etc. The healthcare system has had these issues forever. When I worked in the hospital in the 90's, I can think of 4 examples of significant major errors that have changed the way we do things today. All is well, you're okay, the patient's okay, and move on LOL. The fact that you reported it means you're pretty outstanding!",no
"Male np here, this is asinine. If you want physician pay go to med school. ",no
"Well the general thought over this is, that the NP(s) in question haven't really thought through this, surprise. Let them give equal payment. Now which profession are hospitals/ clinics more likely to hire, physicians or midlevels, who can do less and who need more supervision?",no
"Don't write stupid shit like provide a sandwich on your ED orders - it's demeaning af. Find out where the pantry is and provide it yourself, call it building a patient-physician relationship. Don't put down an order sheet and then come back every 5 mins to add more. Collect your thoughts. We have 4+ other patients, we don't have time to stay with one patient with you while you tick off items in your plan of care one order at a time. 
 
 
 Respect your experienced nurses. Ask them their thoughts. Say things like so, how bad is it? How do they look what do you think about... Don't be afraid to share your thoughts, or how you would assess certain things. Everyone wants to learn and improve, especially emerg nurses. 
 
 
 Good luck :)",yes
"Everyone brings up drug prices, and while I think that's a fair focus, ridiculous drug prices tend to only affect certain new drugs/ older drugs which get a new indication and thus the companies opportunistically price gouge. We need to focus more on the fact Americans are being lied to that they can readily get care in general. I live in the Sacramento area, it's actually a happening place where a lot of people are moving, but a number of my patients can't get into a primary care physician for 3 months if they have Cadillac insurance, more if they have one of the many plans that have been dropped by most systems in my area. The state expanded Medicaid coverage massively last year, but both pcps and specialty offices aren't taking Medicaid for the most part other than already overburdened FQHCs. Kaiser got a nice cushy contract with the state to supply Medicaid coverage, but patients already in the Kaiser system already struggle to get in with their PCPs and if they need a specialist it's an added struggle. When I did locums last year I paid for kaiser. I was not able to get into a primary and kaiser refused to pay for my adhd medication because I didn't have a kaiser psychiatrist, which likely would have taken over a year to establish. I certainly felt like I was cheated out of thousands of dollars, paying a monthly premium for insurance and not even being able to access services, but I can't say i was particularly surprised. The public as a whole seems to be absolutely blindsided when they really need medical care and get turned away at every corner because there aren't enough doctors to take care of them and none of the hospitals in the area want to deal with their insurance.",yes
"I'm so sorry... No excuse for that treatment, none. I have a feeling you are an exceptional patient advocate and empathetic nurse. Please take care of yourself.",no
"Oh this is my biggest peeve. I have spent many years flight nursing and I can't tell you how many times my partner and I have arrived to find a tachycardic and tearful intubated patient because the nurse ""gave rocuronium because they wouldn't tolerate the tube"". Like what. A physician ordered a paralytic and a nurse was like oh yeah this is a great idea without fucking sedating a patient. I got to be known as the candyman, I medicated the shit out of everyone (appropriately medicated), I have zero issue with emptying my med box on a patient to make them comfortable. These fools would even start meds to control the hypertension and tachycardia, you know, because the patient was AWARE of literally everything but was paralyzed. There were so many other instances of major injuries and patients receiving one dose of a pain med hours before and nothing else, patients were often in tears or almost in tears when we arrived. For the love, medicate patients, there is nothing wrong with taking care of their pain and/or anxiety but there is something wrong with not taking care of it, SMDH.",yes
"What're the medical tropes you see that make you laugh or just get your goat? I've been binge-watching ""The Mentalist"" -- in one episode, he knows someone's not a doctor because their handwriting is legible, and, in another, IDs a victim as a doc by their crappy handwriting. And i felt called out.",no
"Male (former) ICU nurse with a large beard here. I think making assumptions about other people bodies, and what they want it to look like, is definitely a bad idea. Shaving largely a US/western practice. Many people see hair as a religious or cultural belief. Also, what families and other nurses like is irrelevant. What matters is the patient's preference. If you don't know what it is then I wouldn't impose my personal beliefs on them. Also, my wife would drop kick a nurse across the unit if someone shaved my beard. Ha",yes
"This hospital system is huge. It has many, many hospital campuses throughout the state, none of which are actually affected by the storm, just the community around this specific one. They are not hurting for money. They asked for volunteers to go 3 hours away to help work nights at this hospital. Lodging at the hospital included...meaning a shared conference room or something. (Obviously the hotels are full, that isn't the issue.) But to not offer crisis pay or incentive pay or anything beyond base pay?!? Maybe I'm just really selfish with my sleep (I have a hard time sleeping anywhere other than my bed, am effected my any noise or light, can't sleep with snoring, and will wake up easily and not get back to sleep. If I go, I won't sleep hardly and I can't work that many shifts in a row on no sleep and not kill myself or a patient. I was considering it anyways up to that point. May still if they are desperate). But I feel like this is just another little thing that is just piling up and up on all the shit we deal with as nurses. They tug on our heart strings, knowing we will help out of the goodness of your heart, that we don't want to abandon patients, even risking our own safety, our patients safety, allowing hospitals to get away with short staffing us and tripling us and making us take on more and more roles outside what we are nurses should be doing (housekeeping, secretary, phlebotomy, patient tech) with less and less resources!?! All while paying us shit, never giving us raises to reflect what we do more and more or matching cost of living, never giving us incentive pay, and guilting us into picking up extra shifts or extra roles to make up the slack! Maybe I'm just tired on very little sleep and going through post-vacation depression and hurting for everyone affected while happy my area was spared, and getting seriosuly burnt out after 4 years of this shit. Maybe I'm wrong to be mad about no extra pay, that this specific siuation is greater than that and my opinions about my hospital system and my lack of sleep lately are clouding my judgement. Just needed to get it off my chest and see what others feel like.",yes
"Hard to say but it's 6-12 months to start feeling some confidence in EM. That said the missing ingredient here is time spent in the main ER which is why I am always a little skeptical of UC or fast track jobs when starting out. You should be able to identify a sick patient hopefully after graduation, but identifying subtle presentations of other serious pathology takes time and if you aren't getting that exposure to these types of patients on the regular it can be stressful when starting out. Pathology can be sneaky and these patients will absolutely find there way into FT from time to time    I would really clarify what it means to have support from an MD in main ER, because 99% of the time this means that there will be a very busy doc working with acuity and won't have time or doesn't really want to be bothered to review cases with you. Maybe ask some of the other PAs who have been there for awhile what this actually looks like and then make your decision.",no
"My first job was inpatient cardiology out of school. I didn't know anything when i started. Now being one year into the job, I am much more confident than I was. I think that's how you feel for any job out of school, regardless of specialty. You're talking about going to outpatient, I've now transitioned into an inpatient AND outpatient role for cardiology. I can say I would not be half the provider I am in the outpatient setting if it wasn't for my experience while inpatient. You learn the most in the hospital setting. I would recommend staying in this job unless it is detrimental to your mental well being. A first job in cardiology is hard, but it gives you an extremely solid foundation for the rest of your career once you get your feet under you",no
"The pacu and floor nurses afterwards marking the patient off the list ""yup, knew he wasn't come back to us by cancellation or otherwise"" I didn't see nothing this bad in the OR during covid, but we saw some wild things and I totally can visualize in my head how this entire circus went down.",yes
"I worked with this one psych nurse who's known for working 6 12s (night shift), like back to back, She's very pleasant. I was trying to get to know her, She then hit me out of nowhere with the first dark humor i've heard in this field, She said it better, but it went along the lines of, *I used to work in med-surg, but I honestly couldn't take it anymore. My patients deaths were just taking a huge toll on me. So I switched to psych. At least in this field it isn't us killing the patients*. Mind you, my jaw dropped and no she has never killed or harmed any patient in med-surg. She just meant with the code blues and stuff, and sometimes them not being successful with trying to resuscitate the patient,",yes
"Ok. As a medical doctor, if I ever had to go through alcohol withdrawal, I would not want it to be managed by a psychiatrist. It warrants medical supervision. Of course there is some mild withdrawal that can be managed in an outpatient setting, but if it makes you sick enough to be in a hospital, you should be in a medical unit and may even require telemetry.",no
"If he was an organ donor then why was he even sent to the morgue? We keep ours, as we are supposed to, on the vent until they get into surgery to remove the organs otherwise you risk rapid cell death in those organs. Especially, too, if holding the patient for family. They should've been able to walk to the surgical suite doors with their loved one. I've never seen an organ donor not be on a vent as the drs usually don't remove them immediately after death. They are planned surgeries. Unless there is a rush for an organ, that is. Do they not do this anymore and, if not, why? Are the docs getting to the organ donors quickly after death? Hmmm. I can't see where cell death would not occur without oxygen circulating.",yes
"Alcohol-consumption favors thiamine defficiency. Alcohol withdrawal often happens in psychiatric hospitals, where patients are closely monitored. So, it's probably a statistical overrepresentation of alcoholics in withdrawal state, as they are monitored more closely.",no
"I like to know things like patient can be a raging cunt for no reason instead of being blindsided by it. If there are any family members that cause issues. Otherwise, why they're here, how they move/toilet and any issues you had on your shift that can affect me. The rest I can look up as I need to know.",no
I'm not a nurse but nearly all of my friends are. Every single one of them have told me a med error story. It happens to everyone. You did the right thing by reporting it and checking for allergies. This is going to stick in your mind the rest of your career and you'll be a better nurse because of it. From a chronically ill patient- thank you guys for everything you do!,no
"Yeah, like now where am I going to find a doctor who's willing to go ""eeny, meeny, miny, moe"" with my organs to determine which one he wants to remove?",yes
"I didn't realize that these procedures were done without sedation until reading about it on Reddit (didnt do any outpatient gyn as a med student) and was shocked that anyone would consider doing such invasive procedures without sedation or at least IV dialysis. Same thing with cystoscopy. Just out of control, frankly.",no
